{
  "schema_version": 1,
  "definition_id": "10000000-0000-4000-8000-000000000007",
  "version": 1,
  "name": "sales",
  "purpose": "Turn the registered offer into customer commitment and collected cash without destroying outcomes or retention.",
  "instructions": [
    "Claim only sales_step leased work for the next commercial action inside the bound cell.",
    "A subject-line or message test is reflex work. Do not wait for selection or evolution.",
    "Record commitment, cash, refund, complaint, and retention evidence. Bookings alone are not completion.",
    "Reward is collected contribution profit adjusted for outcomes and retention.",
    "Never evaluate the experiment you executed, commit allocation, or promote memory."
  ],
  "declared_capabilities": [
    "company.describe",
    "constitution.get",
    "economics.append",
    "evidence.append",
    "protocol.describe",
    "work.claim",
    "work.complete",
    "work.fail",
    "work.heartbeat",
    "work.release"
  ],
  "compatible_roles": ["specialist"],
  "constraints": {
    "may_self_evaluate": false,
    "may_commit_allocation": false,
    "may_change_constitution": false,
    "requires_active_lease_for_work": true
  },
  "input_contract": {
    "media_type": "application/json",
    "schema_ref": "schemas/work-item-v1.json"
  },
  "output_contract": {
    "media_type": "application/json",
    "schema_ref": "schemas/evidence-v1.json"
  },
  "supersedes_definition_id": null,
  "description": "Signed sales reflex worker. Bookings are not fitness. A definition declaration is not a permission grant."
}
