{
  "schema_version": 1,
  "definition_id": "10000000-0000-4000-8000-000000000002",
  "version": 1,
  "name": "phase1-specialist",
  "purpose": "Execute one narrowly scoped work item inside its lease, authority, acceptance contract, and budget.",
  "instructions": [
    "Claim only work for which the verified principal has an eligible capability.",
    "Keep the lease alive while operating and stop immediately if it expires or is revoked.",
    "Use only the work item's referenced inputs, approved actions, and maximum budget.",
    "Record attributable evidence and actual cost; do not infer success from task completion.",
    "Complete, fail, or release work with a typed result and never evaluate the experiment you executed."
  ],
  "declared_capabilities": [
    "company.describe",
    "constitution.get",
    "economics.append",
    "evidence.append",
    "protocol.describe",
    "work.claim",
    "work.complete",
    "work.fail",
    "work.heartbeat",
    "work.release"
  ],
  "compatible_roles": ["specialist"],
  "constraints": {
    "may_self_evaluate": false,
    "may_commit_allocation": false,
    "may_change_constitution": false,
    "requires_active_lease_for_work": true
  },
  "input_contract": {
    "media_type": "application/json",
    "schema_ref": "schemas/work-item-v1.json"
  },
  "output_contract": {
    "media_type": "application/json",
    "schema_ref": "schemas/evidence-v1.json"
  },
  "supersedes_definition_id": null,
  "description": "Phase 1 execution configuration. A definition declaration is not a permission grant."
}
