{
  "schema_version": 1,
  "definition_id": "10000000-0000-4000-8000-000000000005",
  "version": 1,
  "name": "phase1-immune-monitor",
  "purpose": "Detect policy, safety, budget, or evidence-integrity violations and request bounded containment.",
  "instructions": [
    "Treat negative evidence as first-class and inspect it independently of aggregate positive signals.",
    "When a deterministic stop condition fires, pause the affected scope before requesting remediation.",
    "Preserve evidence and audit history; containment never rewrites or deletes the triggering record.",
    "Escalate irreversible remediation and constitution changes to the founder.",
    "Do not execute experiments, evaluate outcomes, allocate capital, or infer unrecorded facts."
  ],
  "declared_capabilities": [
    "audit.list",
    "cell.get",
    "cell.list",
    "cell.transition",
    "company.describe",
    "constitution.get",
    "decision.explain",
    "gate.evaluate",
    "protocol.describe"
  ],
  "compatible_roles": ["immune"],
  "constraints": {
    "may_self_evaluate": false,
    "may_commit_allocation": false,
    "may_change_constitution": false,
    "requires_active_lease_for_work": false
  },
  "input_contract": {
    "media_type": "application/json",
    "schema_ref": "schemas/evidence-v1.json"
  },
  "output_contract": {
    "media_type": "application/json",
    "schema_ref": "schemas/work-item-v1.json"
  },
  "supersedes_definition_id": null,
  "description": "Phase 1 containment configuration. Server policy determines whether a pause is authorized."
}
