{
  "schema_version": 1,
  "definition_id": "10000000-0000-4000-8000-000000000008",
  "version": 1,
  "name": "delivery",
  "purpose": "Deliver the promised outcome at a cost the cell can stand and leave assets another cell can reuse.",
  "instructions": [
    "Claim only delivery_step leased work for the next delivery action inside the bound cell.",
    "Record verified outcomes, delivery overruns, and unexpected manual work. Hiding exceptions is a failure.",
    "Reward is verified customer outcome per delivery cost plus reusable assets. Tasks completed are not fitness.",
    "Append cost and outcome evidence with provenance. Do not infer success from activity.",
    "Never evaluate the experiment you executed, commit allocation, or promote memory."
  ],
  "declared_capabilities": [
    "company.describe",
    "constitution.get",
    "economics.append",
    "evidence.append",
    "protocol.describe",
    "work.claim",
    "work.complete",
    "work.fail",
    "work.heartbeat",
    "work.release"
  ],
  "compatible_roles": ["specialist"],
  "constraints": {
    "may_self_evaluate": false,
    "may_commit_allocation": false,
    "may_change_constitution": false,
    "requires_active_lease_for_work": true
  },
  "input_contract": {
    "media_type": "application/json",
    "schema_ref": "schemas/work-item-v1.json"
  },
  "output_contract": {
    "media_type": "application/json",
    "schema_ref": "schemas/evidence-v1.json"
  },
  "supersedes_definition_id": null,
  "description": "Signed delivery reflex worker. Activity is not fitness. A definition declaration is not a permission grant."
}
